,Unnamed: 0,names,tag_lines,personality,sex,breed,rescue_grp,location,coat,date,fee,age_in_months,preference
326,326,Franky ,Beautiful Natured Cat,"* PLEASE DO NOT APPLY TO ADOPT FRANKY IF YOU DO NOT ALREADY HAVE A SUITABLE CAT*
Franky is an absolutely special creature, he is as full of love that a cat can be.  He will cuddle you and purr until your heart is content.  His heart, however, will never be content, there is no end to the cuddle.  Prepare for a life of cuddles.  Franky doesnt get stressed out; nothing phases him, hes as beautiful with other cats as he is with humans.  Dont think hes just all about the love though, Franky  loves to play as hes still only 10 months old.  Franky would be best suited to a home with another young cat or kitten as he has been a wonderful playmate to kittens  He also needs an owner willing to spend a lot of time with him because he deserves it.  An absolutely beautiful soul, hell get snatched up very quick. 
Franky will do well in a home with adults/teenagers or respectful older children. Franky has not been tested    with dogs.",Male,Domestic Short Hair Cat,Heart & Soul,"Ringwood, VIC",Short,"09 Jan, 2022",325.00,10.0,Doesn't have kids under 5
327,327,Murphy and Eli ,Bonded Brothers,"Eli & Murphy are two handsome ginger domestic shorthair brothers. They are looking for a home where they can keep their brotherhood going as they are a very bonded pair who bring out the best in each other. Despite of their matching look, it is easy to tell them apart as Murphy has a sweet little white spot on his nose, whereas Elis nose is fully ginger. 
Murphy is an affectionate boy who loves pats and head scratches. He is the adventurous and confident one of the two and likes to be the first one to explore and conquer new areas of the house. Eli is the calm and gentle brother who takes cues from his outgoing brother and as a consequence, has also learnt to celebrate the wonderful world of pats and attention. Eli likes to sit back and stay in the home base while Murphy explores. They are both very playful and love to engage in play with humans or with each other. As best friends, they happily entertain themselves for hours just by playing hide and seek, or wrestling like young boys do. 
Eli and Murphy are looking for a loving home that will support their affectionate yet playful personalities by engaging with them in play and continuing to show them how wonderful it is to have human pats and cuddles. They have been fostered with other cats and a dog and would suit a household with a cat friendly canine. They will need to go into a calm home with a family that has respectful older children/ teenagers.
Will you be the one to offer a loving home to this affectionate and laidback ginger duo?",Male,Domestic Short Hair Cat,Heart & Soul,"Croydon, VIC",Short,"09 Jan, 2022",650.00,7.0,Doesn't have kids under 5
328,328,Abraham ,Beautiful Natured Cat,"Abraham
Im a distinguished gentleman with very good manners and while I dont like to sit in your lap or be held for more than three seconds just yet, I am very affectionate and enjoy pets and cuddles (as long as I can stand on a table). My foster mum can even scratch my belly. Im not picky about my food and enjoy the occasional chicken neck. I would be best suited to a calm home that has another cat for company. Out of nine foster siblings I only dont get along with two of them. So Im pretty easy going! 
I have not been tested with dogs and would prefer a teenage/ adult only home.
I can't wait to meet you! ",Male,Domestic Short Hair Cat,Heart & Soul,"Kingsville, VIC",Short,"09 Jan, 2022",250.00,50.0,Doesn't have kids under 5
329,329,Bartholomew,Beautiful Natured Boy,"Bartholomew (Barty) This gorgeous tabby boy can be summed up in one word happiness.  Barty is always happy and loves nothing more than to be surrounded by his foster family whether that be cat, dog or human.  He is cuddly and friendly and would make a delightful best friend.  He is learning to play and enjoys chasing a ball and would love a family who will have time to spend playing with him.  He loves the company of other cats and would love a friendly kitty friend.  Barty was born and raised on a farm and living inside is still new to him so he can be a little shy and startled by loud noises.  If you love being surrounded by happiness then Barty may be just what youve been looking for.",Male,Domestic Short Hair Cat,Heart & Soul,"Mount Martha, VIC",Short,"10 Jan, 2022",300.00,10.0,Doesn't have kids under 5
330,330,Penny and Gaia ,Gorgeous Bonded Girls,"Meet Penny (white nose) and Gaia.
These girls are a very special bonded pair.
Totally adorable is the best way to describe these two!
They love to snuggle up together and they have a beautiful friendship. 
Both girls will take some time to settle into their forever home and will be shy and timid to begin with, but once they feel comfortable to come out of their shell, you will see their personalities shine!
Penny is a little more uncertain of humans than Gaia, but once settled her cute and playful soul will win your heart!
Gaia's favourite daily activities are snoozing on her bed or in a cardboard box and wrestling with Penny. Whilst Penny is pretty much happy to do anything with Gaia by her side.
They are low maintenance girls who are happy being around people all day or on their own, so they would suit either household. 
They will need a home with no other pets but would be suitable to be in a home with older children. 
Can you offer Penny and Gaia a place to call their own?",Female,Domestic Short Hair Cat,Heart & Soul,"Roxburgh Park, VIC",Short,"09 Jan, 2022",400,32.0,Doesn't have dogs| Doesn't have kids under 5| Doesn't have kids from 6 to 12
331,331,Ronin and Sterling ,Bonded Besties,"Ronin (Bangers)~BrownTabby and Sterling(Mash) affectionatly known as Bangers and Mash~aka Bang Bang and Mashie.
These cheeky young boys are curious explorers and love to find new nooks and crannies in the house.  Bangers is a sweet soft gentle boy that is big on love and affection and will follow you around the house.  Mash has big expressive eyes and is very playful with his collection of toys.  They both like cuddles and scratches from their humans.  
In the morning, they will be waiting for you excited to be fed and petted.  By day they might curl up in their basket or find a sunspot. In the evenings they get more active. Bangers and Mashie are playful enough for an active household or calm enough for a quieter forever home.
Can you offer this beautiful pair of boys a place to call home?",Male,Domestic Short Hair Cat,Heart & Soul,"Williamstown, VIC",Short,"09 Jan, 2022",500,11.0,Doesn't have dogs| Doesn't have kids under 5| Doesn't have kids from 6 to 12
332,332,Belgrave,Confident and friendly!,"Confident, friendly and playful - Belgrave is a handsome and ridiculously affectionate boy looking for his perfect forever people!
He is incredibly affectionate and will be your little shadow - following you from room to room so he can be right beside you. 
Belgrave LOVES his pats and cuddles and is very demanding of them. He doesnt care if youre on a zoom-meeting - he needs his pats! 
As sweet as he is, Belgrave also considers himself the boss of the household and can occasionally be a little bit of a jerk about it. He doesnt like being told what to do and will make this pretty clear to you.
Being rushed, blocked by arms or trapped in small spaces are Belgrave's hard boundaries and hell let you know. Because of this, Belgrave would do best in a large home or one with an enclosed outdoor area. He considers children merely beneath him and so will need a home with adults only, where he can remain the centre of attention. 
We're looking for a specific type of adopter who is willing to work with us to help Belgrave find a better outlet for his anxieties. He'll need lots of play and love!
Despite his jerk tendencies, Belgrave is an incredibly fun cat to have around who really just wants to be loved and spoiled. Just dont get on his bad side...
If Belgrave sounds perfect for you, please complete the short adoption application form in the attached link, please note this is the only way your application will be considered: https://homelesshounds.com.au/adopt/cats",Male,Domestic Short Hair Cat,Homeless Hounds Animal Rescue,"Carlton, VIC",Short,"09 Jan, 2022",500.00,14.0,Doesn't have cats| Doesn't have dogs| Doesn't have kids under 5| Doesn't have kids from 6 to 12
333,333,Isa,Sweet and smoochy,"Meet Isa! - The Executive Cat
Isa is incredibly cute and fluffy - but dont let that fool you! He has a flair for business. He loves to sit in-front of your computer and sleep on your office chair.
If youre working from home - Isa will be the perfect office companion! Think of him like a strangely affectionate colleague. He is ready for business, but especially so, if that business includes a good cuddle at lunch time. 
If youre not working from a home office, not to worry - when Isa clocks off hes a regular cat who loves to play, eat treats, cuddle and sleep.
Isa is your typical ragdoll meaning he is a very calm boy who loves his snuggles. He will even keep your feet warm at night as his favourite spot to snooze in is your bed. 
We are looking for a great home for Isa where he is free to be the fun little guy he is! He loves to be the centre of attention - so will do best in a home with no other pets or young children.
Overall, Isa is a sweet-natured cat who will make a great companion to just about anyone!
If Isa sounds perfect for you, please complete the short adoption application form in the attached link, please note this is the only way your application will be considered: https://homelesshounds.com.au/adopt/cats
PS: Youll see in some of Isas photos that he is shaved. Isa came to us matted and his whole torso had to be shaved! It is in the process of growing back and his luscious locks will be back in no time.",Male,Ragdoll Cat,Homeless Hounds Animal Rescue,"Canterbury, VIC",Long,"09 Jan, 2022",600.00,84.0,Doesn't have kids under 5| Doesn't have kids from 6 to 12
334,334,Alfred,Looking for love,"Hi my name is Alfred and move aside Batman, it's my time to shine, so light up the cat signal when you're ready for some love. I'm always ready and always prepared.
I'd love to have my own cat cave and tower to watch over everything from. I'll fight off those villains. I'll destroy my scratching post and catch those sneaky feathers and balls. I'm no joker, but I do love to play. I can get carried away and can sometimes accidently leave unintended casualties in my wake so I'd do best in a home with older cat-savvy kids or teenagers that are more resilient. 
When I'm done fighting crime I love to be rewarded with some good lovin' and smooches. I'm as loyal as they come and will follow you around to make sure you're protected, and to double check if you're ready to play again. 
I used to roam the city wide but now am ready to defend just the one home, but only the inside as I may not be able to stop myself picking up old habits. Like my good friend Mr Wayne, I prefer to roll solo and would prefer to be your one and only defender of justice.
I am desexed.
Microchip #956000014571528",Male,Domestic Medium Hair Cat,RSPCA Epping Animal Welfare Facility,"Epping, VIC",Short,"09 Jan, 2022",50.00,13.0,
335,335,Casper,Looking for love,"Oh hello there. My name is Casper and I've had a big life so far, now I'm ready to settle down into my forever home with my new family. 
I'm a fairly confident and chilled out guy (as long as my four paws stay on the ground). I don't like being picked up but I LOOVE to get scratches and pats from my human chums. I'd be pretty happy to do my own thing while you're at work as long as you can give me love and affection when you're at home. 
I have to be inside only so that I can avoid that pesky sun damage - and just ensure that I'm kept safe and sound in general. 
Do you think that you can give me a second shot at life?",Male,Domestic Medium Hair Cat,RSPCA Epping Animal Welfare Facility,"Epping, VIC",Short,"09 Jan, 2022",0.00,147.0,
336,336,Martin,Looking for love,"mc#956000013349763
I'm a savvy cat who knows the score. I don't mind entertaining myself, but a human companion at the other end of the couch and a nice scratch behind the ears always makes my day.
My hobbies include eating, sleeping and smooching. I'm looking for someone who enjoys quiet time and togetherness. Could that someone be you?
I might be ok living with a friendly dog or cat.
Do you want a cat who will give you endless head boops and purrs? If so, I'm the one for you!",Male,Domestic Short Hair Cat,RSPCA Wangaratta Victoria,"Wangaratta, VIC",Short,"09 Jan, 2022",,25.0,
337,337,Domino,Looking for love,"Domino was surrendered to the RSPCA by the previous owner. We have some prior history.
My hobbies include eating, sleeping and smooching. I'm looking for someone who enjoys quiet time and togetherness. Could that someone be you?
My light features need to be protected from the sun, so I need to live indoors.
I might enjoy living with a friendly female cat for company and I might be ok living with a friendly dog.
I am not very confident with children, so I would prefer to live with adults
MC: 956000006038663",Male,Domestic Short Hair Cat,RSPCA Pearcedale Victoria,"Pearcedale, VIC",Short,"09 Jan, 2022",22.00,85.0,
338,338,Minnie,Sweet natured,"Well hello from  Minnie
"" My human Mum is moving  to another house and is unable to take me.
I am a very good, affectionate girl, however I like to stay indoors, as it is safer. There are no comfy beds, chairs or laps out the front door.""
If you are interested in Minnie and you live in Melbourne, happy to meet at Seymour for adoption.",Female,Domestic Short Hair Cat,Little Paws & Big Paws Animal Rescue Inc.,"Shepparton, VIC",Short,"09 Jan, 2022",100.00,36.0,
339,339,Matilda,Looking for love,"mc#956000013351148
I can be shy at first, but all I'm looking for is someone to love me. I am very snugly and sociable once I get to know you. My perfect day would be waking up on your bed, having a nap on your lap while you watch TV, and having scratches on my tummy in the afternoon. I'm such a smoochy cat, and I would love to spend a lot of time with you.
I am a cat who likes to relax, so I'd prefer a quiet adult home.
I might be ok living with a friendly dog or cat.",Female,Domestic Short Hair Cat,RSPCA Wangaratta Victoria,"Wangaratta, VIC",Short,"09 Jan, 2022",,18.0,
340,340,Blacky,Sweet & gentle,"URGENTLY LOOKING FOR A FOSTER 
OR A FOREVER HOME
Blacky is a cute black long hair 7 yo lady. She was rescued from the streets in the beginning she was extremely shy and scared but never aggressive. She didnt trust anything nor anyone at all. She was skin and bones. She spent the first 2 month curled in her bed sleeping. However she ALWAYS used and uses her litter box. 
Slowly she started trusting and allowed us to pet, brush and even groom her. In December she started leaving her bed at nights and walking around the living room, coming closer and closer to us and even giving us head rubs and kisses  
Slowly we started to place her food further and now she has her diner in our bedroom. she loves being around people but she doesnt like loud noises. When we are working on our desk she comes and lies under the desk purring and showing us her, now, round belly. She is still very shy but every time I go to her bed she starts purring so loud and even drooling of happiness and excitement. She likes giving very gentle loving bites in my hand when she is happy and very relaxed. 
She recently started playing with a toys with feathers. First we thought she was hunting but now we see her having fun with that toy. Also, she adopted a stuffed toy as her baby and plays with it and even grooms it.so sweet! 
Blacky is Fiv+ So will need to be in a home with no other cats!",Female,Domestic Long Hair Cat,Give a Kitty a Home,"Broadmeadows, VIC",Long,"09 Jan, 2022",150.00,88.0,Doesn't have cats| Doesn't have kids under 5
341,341,Sir Puddin',Sweet and affectionate,"Sir Puddin is a gorgeous little man with the most sweet, playful and affectionate little personality!
He is a very loving boy - hell follow you from room to room to make sure he can be where the action is. 
Among his favourite things in the world are play, pats, belly rubs and talking! Sir Puddin is a super talkative boy who loves to have a chat. He is also quite happy to be picked up and cuddled. 
Sir Puddin was a little timid when he first came into our care but has come leaps and bounds since then. We are looking for an experienced cat owner for Sir Puddin who is ready to give him all the attention and love he deserves.
Overall, Sir Puddin is a sweet boy with a gorgeous temperament. He would make the perfect companion cat to just about anyone!
If Sir Puddin sounds perfect for you, please complete the short adoption application form in the attached link, please note this is the only way your application will be considered: https://homelesshounds.com.au/adopt/cats",Male,Domestic Short Hair Cat,Homeless Hounds Animal Rescue,"Brunswick East, VIC",Short,"08 Jan, 2022",300.00,24.0,
342,342,Yoshi,Sweet & snuggly girl,"Yoshi , shes a sweet teddy bear!
This cutie is so easy going and an absolute sweet heart. She loves a good snuggle and never turns down a pat. She is shy and cheeky at the same time which is the most charming thing about her. 
Yoshi is bonded with her twin brother Kenji, they are never apart and love to spend their days wrestling and playing hide and seek, followed by a long nap cuddled up together when they tire themselves out. Brother Kenji loves to protect Yoshi and care for her, we would love to have the twins go to their forever home together, but they can be adopted individually as well, as kittens adapt easily.
Yoshi is friendly with other cats, just unsure about dogs which she finds a bit intimidating. Yoshi is best suited to a home with calm kiddos or without. ",Female,Domestic Short Hair Cat,Give a Kitty a Home,"Hoppers Crossing, VIC",Short,"08 Jan, 2022",400.00,2.7600000000000002,Doesn't have dogs
343,343,Kenji,Sweet and easy going,"Kenji, your favourite grizzly bear!
Our little boy Kenji has a playful and cheeky personality. His favourite past time is wrestling with his twin sister, Yoshi. 
The pair have become very bonded and do everything together: eat, play, sleep, repeat. Kenji loves to cuddle and groom his sister, he protects her with all his might against the bigger kitties in his foster home. We would love to see the twins go to a home as a pair to grow old together, but they can be adopted individually as well, as kittens adapt easily.
Kenji is very sweet and easy going in nature, however is unsure about dogs, so we prefer that hed go to a home with no dogs. He is fine around adult cats  Kenji would be suited to a home with calm kiddos or without.",Male,Domestic Short Hair Cat,Give a Kitty a Home,"Hoppers Crossing, VIC",,,,0.0,Doesn't have dogs
344,344,Daniel and Dominic ,Bonded Brothers,"Daniel(Medium Hair)
Hi! My name is Daniel and Im a super playful, active kitty who loves being the centre of attention. Im not really a lap kitty just yet though, as I can be a bit restless sometimes. But I looove pats and am always on the prowl for any opportunity to play with my foster carers. (My favourite toy to play with is a ping pong ball!!). I also have adorable, fluffy fur which makes me extra fun to cuddle. Something unique about my brother and I is that we have super cute meows, which can sometimes come out a bit squeaky! My foster carers think this probably has something to do with how we started life out on the streets.
Dominic 
Hi! Im Dominic and Im a cool tabby cat whos just started to learn about how good pats are!! To start with, I can be really shy and afraid of new people, and some would probably say I have trust issues! But inside Im SUPER interested in people and Im a bit obsessed with sniffing my foster carers hands to find out what theyve been up to! Just like my brother I also love to play and will chase most things that move. Now that Ive learnt how good pats are though my favourite time of the day is the morning when my foster carer wakes up, because she always gives me lots of pats to make up for the time shes been asleep. If you adopt me I would love to receive your love and affection, but you might have to be a bit patient with me, as it might take me a while to learn that youre truly my friend. 
Please adopt Daniel and I! We have really blessed our foster carers by being in their home and are looking forward to meeting our forever family! 
Also, my foster carers say that we would probably be better with older, more mature children than younger ones!
We have not been tested with dogs.",Male,Domestic Medium Hair Cat,Heart & Soul,"Clayton, VIC",Medium,"08 Jan, 2022",550,13.0,Doesn't have kids under 5
345,345,Margaret,Calm and friendly,"Margaret is an absolutely gorgeous senior lady with the most calm and affectionate personality around.
She enjoys the simple things in life; sitting on comfy sheets and towels in the cupboard, or watching the day go by on top of a cosy pot plant on the balcony.
Margaret loves her people and prefers to be near them when she can. She enjoys a good head scratch and chin rub. 
She is incredibly calm, incredibly cute and incredibly lovely and would really just make a wonderful pal to any person wanting a companion cat to laze the days away with. 
Margaret has had some ongoing skin issues, but is otherwise healthy! Not bad for a 10 year old! She is on a special diet for her skin to make sure her tummy doesnt get too sore or her skin too itchy.
Despite being a senior, she does occasionally like to play with her favourite string toy.
Overall, Margaret really is a lovely cat. We are looking for a quiet home who will just love her to bits throughout her golden years. She is a special girl deserving of an even more special home. 
If Margaret sounds perfect for you, please complete the short adoption application form in the attached link, please note this is the only way your application will be considered: https://homelesshounds.com.au/adopt/cats",Female,Domestic Short Hair Cat,Homeless Hounds Animal Rescue,"Brunswick, VIC",Short,"08 Jan, 2022",300.00,120.0,Doesn't have cats| Doesn't have dogs
346,346,John & Sammy,Looking for love,"John (10yo) and Sammy (13yo) are a bonded pair who adore and rely on each other. John stresses without Sammy, he does not need to be with Sammy every minute but knowing Sammy is near keeps him calm and content. They Sleep together but are happy to do their own thing during the day.
Sammy is the more outgoing and confident of the pair, he will seek out your attention where as John will sit back and watch hesitantly until he decides what he wants to do.
They would love a quiet retirement home where they can laze away the days without children or canines. An indoor only home as they are both  FIV+ and at their age they deserve an indoor only home where they are safe and comfortable.
About FIV in Cats FIV cats live many years without any health problems. FIV cannot be transmitted to humans, dogs or other pets. FIV can only be transmitted to other cats through deep blood-drawing bite wounds. Being indoors only and having access to a cat run will reduce any possibility of him being attacked or fighting with another cat.
MC Nos: 956000001742998 & 956000013292174
ADOPTION BY APPOINTMENT ONLY
To make an appointment please complete an online application via the attached link https://www.catprotection.com.au/adoption-online-application-2/",Male,Domestic Short Hair Cat,The Cat Protection Society of Victoria,"Greensborough, VIC",Medium,"08 Jan, 2022",120.00,122.0,Doesn't have cats| Doesn't have dogs| Doesn't have kids under 5| Doesn't have kids from 6 to 12
