,Unnamed: 0,names,tag_lines,personality,sex,breed,rescue_grp,location,coat,date,fee,age_in_months,preference
170,170,Mon- Mon ,Beautiful Baby,"PLEASE DO NOT APPLY TO ADOPT MON- MON IF YOU DO NOT ALREADY HAVE A SUITABLE CAT
: Mon-Mon
Color: Brownish tabby with orange patches and white socks
D.O.B: 27.09.2021
Personality: Mon-Mon is a calm little kitten who is a total sweet-heart, whom is a bit timid at times. She enjoys cuddles and kisses. Occasionally likes to sleep on the bed and on your lap. Mon-Mon likes her own spaces and tends to sleep majority of the day. She is a bit on the curious side and does like to explore her environment and at times play with random things she can get her paws on. 
Activity level: Mon-Mon activity level would be considered fairly moderate as shes more of a couch-potato and likes to sleep. However, she can be quite playful at time as she likes to chase the cat laser and play with people too. 
Toys: Mon-Mons favorite cat toy is a catnip toys .
Children: This Kitten would suit a household with teenagers and adults, if not only adult household is fine. She tends to keep more to herself hence may not be too comfortable with children.  
Dogs: Mon Mon has never been exposed to dogs, do not recommend them to a household.
Mon Mon will need to be adopted into a home that already has a playful suitable cat.
Food/heath concerns: Mon-mon has no major food or health concerns. 
Foster comment: Mon-Mon is an adorably sweet cat who is likes nothing more than to relax and occasionally play with her favorite catnip toy. Shes a very calm cat and generally likes to keep to herself most of the time, with occasional cuddle sessions. As she grows and gains confidence, she will blossom into a beautiful little soul.",Female,Domestic Short Hair Cat,Heart & Soul,"Clayton, VIC",Short,"14 Jan, 2022",325.00,3.45,Doesn't have dogs
171,171,Malcolm,Looking for love,"Hi! My name is Malcolm!
If you are after a cat who is your shadow, companion, partner in crime, lap warmer and guard dog in a cats body who doesn't actually guard and will hide... Look no further. You have officially found me!
I made my way to the RSPCA after a very long car journey from the RSPCA in South Australia. I was needing a sea-change - I just didn't expect it to be from Foster Care for as long as it has been! 
I am looking for a home with a cat-savvy owner who will appreciate my singing voice and appreciate my need to be around you ALL. THE. TIME. I mean it - I need my humans so much, their love is all that makes me happy in this world. Well, that and toys. But love! All I need is love! I would best suit someone who works from home, or someone retired who is happy lounging the days away with me by their side. Someone who I can give kisses and head boops too with my huge noggin, and appreciate my needy nature. 
I am still living in Foster Care with my amazing Foster Mum because I need that human companionship and my Foster Mummy can give that to me, which keeps me so happy. I do love feline companionship as well and would love a home where I could potentially have a kitty girlfriend to keep me company when you head out to the shops. 
I sadly get anxious if I am left on my own, and my lovely singing voice turns into a very sad crying howl because I just hate hate hate it. I'll make sure you know it too! I need a patient home with no young children, and plenty of routine, stability and not much change. I like familiarity and knowing my place (which will hopefully be glued to your lap). 
I require an indoor lifestyle due to my precious white fur, but that means more time with you, following you... everywhere... even to the toilet if you'll let me. 
I love puzzles and games to keep my anxious mind distracted when you're not around as well, or if you're too warm for my cuddles. 
If you click on that apply button, this may be the start of the most beautiful love story that Taylor Swift would dream to sing about. 
Love,
Malcolm, your big timid polar bear.
Microchip number: 991003001410139",Male,Domestic Short Hair Cat,RSPCA Pearcedale Victoria,"Pearcedale, VIC",Short,"12 Jan, 2022",120.00,76.0,
172,172,Millie,'Loves Cuddles',"Hi, my name is Millie and Im a 14 week old female. Im looking for my furrever home. I love scratches and cuddles, although i can be a bit shy at times. I love to sleep on your bed and I love being near you. I rather not live with dogs or children, but I do like older cats. Please take care of me",Female,Domestic Short Hair Cat,Forever Friends Animal Rescue,"Sunbury, VIC",Short,"12 Jan, 2022",250.00,2.7600000000000002,
173,173,Mayo ,Very Special Boy,"PLEASE DO NOT APPLY TO ADOPT MAYO IF YOU DO NOT ALREADY HAVE A SUITABLE CAT
: Mayo
Color: Mainly white with black spots on head 
D.O.B: 27.09.2021
Personality: Mayo is hyper affectionate cat, which likes nothing more than to play with people, cuddle with them and sleep on their laps. Hes an attention seeker and is quite chatty. He is definitely a foodie and will take any opportunities to get and try new foods. He enjoys watching TV and youtube videos on the computer. Mayo  being a very confident and curious and will often be the first to greet strangers or guest who come for a visit. He is also very calm and rarely gets stressed. 
Activity level: Mayo activity level is high; he likes to play and jump around a lot. 
Toys: His favorite toy is the cat wand and the cat laser .
Children: Mayo would be suitable with children aged 5/6years+
Dogs:This Kitten has never been exposed to dogs, do not recommend him to a household with dogs.
Ideal home: Kitten would be most suitable in a household with children aged 5/6years+. Being very playful and very affectionate he would make an amazing addition to a family with children. Mayo will need to be adopted into a home that already has a playful suitable cat.
Food: Mayo has a tendency to over eat at times, you will need to be cautious with leaving items on the floor as he is curious.
Foster comment: Mayo is an amazingly sweet cat and has very quickly stolen the heart of his foster. Although he is quite energetic he can be very calm too, as at times he just wants to cuddle up with you and watch TV. He also just likes being around people, and will sit or sleep as close to you.",Male,Domestic Short Hair Cat,Heart & Soul,"Clayton, VIC",Short,"14 Jan, 2022",325.00,3.45,
174,174,Taro and Miso ,Bonded Siblings,"Name: Miso (female, white) & Taro (Male, Tabby)
D.O.B: 27.09.2021
Personality: 

Both kittens are very friendly and sweet. They may appear timid first but once they become comfortable they are very cuddly. Taro loves sleeping on the bed and the lap of people, and kisses! A bit more of attention seeker than his sister. He also has the habit of not using his claws when hes playing with people hence has the softest paws. Miso is shyer of people compared to her brother, Taro. Miso is quite chatty and likes to talk back to people. Likes cuddles and playing with people. Both enjoy watching TV and YouTube videos. Also like to watch people do certain chores like sweeping, cooking, and washing dishes. Both kittens are very playful kittens would make wonderful addition to a family household with respectful children and teenagers/adults.
Toys: Favorite toys are the cat laser and electric flutter rotating cat teaser
* Taro likes to horde his toys in his bed
Activity level: Both kittens are moderately active. Taro is more of a couch-potato while Miso is more active as she likes to explore her environment. Both will have occasional burst of energy aka the zoomies. Besides that, they are generally 
Dogs: Kittens have never been exposed to dogs, do not recommend them to a household with dogs 
Ideal home: Ideal home would be a family home with respectful children and teenagers/ adult only home would be just as good too. Taro and Miso prefer a relatively calm environment as they can be both startled with very loud noises. 
Food: Although Taro has a tendency of overeating and eating too quickly and eat random things he can find on the floor, you will need to cautious. Miso is a good little eater.
Foster comment: Miso and Taro are splendid kittens that are both trained to use the litterbox. They both will notify you if the litterbox is full as well. They have never scratched the sofa or ruined any of the furniture in the fosters houses. Both Miso and Taro are well behaved kittens with lots of love to give.",Male,Domestic Short Hair Cat,Heart & Soul,"Clayton, VIC",Short,"14 Jan, 2022",650.00,3.45,Doesn't have dogs
175,175,Charlie,'Very Affectionate',"Hi, my name is Charlie and Im a 14 week old boy. Im looking for my furrever home. I am very affectionate and confident. Sleeping on your lap during the day or being really close to you at night time in bed is my favourite thing. I purr nearly every time you pat me and I enjoy snacks of ham or turkey. Im great with children and do not mind older cats or dogs. Please take care of me!",Male,Domestic Short Hair Cat,Forever Friends Animal Rescue,"Sunbury, VIC",,,,0.0,
176,176,Baileys,Black & white girl,"Baileys is a feisty girl who likes to be the boss & have things her own way. 
She is funny & sassy but also gentle & sweet when she wants to be. She loves other cats & will seek them out when in a playful mood.",Female,Domestic Short Hair Cat,Hannahs Haven,"Mordialloc, VIC",Short,"12 Jan, 2022",400.00,2.99,
177,177,Madori,Bashful ginger,Madori is a gentle boy with lots of love to give. Hes quiet & likes to sit back & watch whats going on around him. He is good with children & other cats.,Male,Domestic Short Hair Cat,Hannahs Haven,"Mordialloc, VIC",Short,"12 Jan, 2022",450.00,2.99,
178,178,Soda,Tuxedo dude!,"Soda is full of bubbly fun & will run all day long! He likes people, other cats & being adored.",Male,Domestic Short Hair Cat,Hannahs Haven,"Mordialloc, VIC",Short,"12 Jan, 2022",400.00,2.99,
179,179,Rella,'Big Personality',"Hi there I'm Rella! I may be pint sized but don't be fooled I have a big personality once you get to know me. I love nothing more than chasing toys and taking ridiculously cute naps near my people. I do start off very shy and take a long time to warm up, I'm also quite independent and not at all cuddly. I like pats but on my own terms, I DO NOT like being picked up and have no problems letting you know it. I need a home with another cat friend, so I can keep growing in confidence. I also can't be with small children or dogs as they are too big and make sudden movements that scare me a lot, somewhere nice and quiet is more my pace. Does anyone out there have the perfect home for me?",Female,Domestic Short Hair Cat,Forever Friends Animal Rescue,"Doncaster, VIC",Short,"12 Jan, 2022",175.00,17.0,Doesn't have dogs| Doesn't have kids under 5| Doesn't have kids from 6 to 12
180,180,Sebastian,Affectionate companion,"**NOTE:  SECURE OUTDOOR CAT RUN/ENCLOSURE REQUIRED**
Sebastian, or Sebbie, is a cuddly senior ragdoll boy who loves nothing more than to curl up next to you and meow for  attention.  
He can be shy at first and prone to hiding but once he's more comfortable, he is extremely affectionate and is always ready for a belly rub and a head scratch.
Sebbie has lived with a dog and other cats before and would be fine with other docile cats but is untested with more dominant cats.  He would be more than happy to be your only pet though so he doesn't have to share your love and attention.  Sebbie isn't fond of children so it would be best he goes to a home without any young hoomans.
His previous owners have moved into a retirement village and were unable to bring him which is how he came into our care.
Sebbie is in good health but did have crystals approximately 5 years ago so it is highly recommended he stay on a urinary diet food to avoid a recurrence.
He's spent his life as an indoor/outdoor cat and his new home will need a decent sized outdoor cat run/enclosure to keep him happy when he's not snuggled up with you.",Male,Ragdoll Cat,Bast Cat Club,"Clyde, VIC",Medium,"12 Jan, 2022",200,129.0,Doesn't have kids under 5| Doesn't have kids from 6 to 12
181,181,Kai,"Smart, chilled & cuddly","Kai is a handsome ginger boy who is very smart with a chilled personality and absolutely loves cuddles with his hoomans.  However, at first he is very shy needing a few days and space to feel comfortable in his new surroundings.
Once Kai feels at home, his soft voice and gentle nature combined with his loud purr machine will endear him to any home.  
He is very well behaved and respectful - doesn't make a mess or tear up furniture.  Thunderstorms though are very frightening for him and he'll hide away until it's over.
Kai is good with children and other cats, if you already have a friendly feline or are looking to adopt a brother or sister for him.
During his time on the streets, Kai contracted FIV so he needs to be contained either as an inside only cat or with a secured outdoor run.  His FIV also means he needs to be on a high quality diet (Ziwi Peak dry and wet food) which he loves.
Kai's favourite activities are watching TV with his hoomans, snoozing in his cat castle or sharing his hoomans bed. 
Kai's ideal home is one that understands his needs, have lots of love to give and keep him secure inside and bonus if theres an outdoor cat run.  In return he'll provide endless love, cuddles and loud purrs.",Male,Domestic Short Hair Cat,Bast Cat Club,"Toorak, VIC",Short,"12 Jan, 2022",150,74.0,
182,182,George - Located in preston,Sweet & affectionate,"George is a lovely fluffy boy who is looking for love.  He is sweet and affectionate and loves nothing more than a good chin scritch.
APPLY ONLINE at http://www.neko.org.au/adoption-application/
Before applying to meet one of our cats, please ensure that
- you have the agreement of all members of the household to adopt a Cat
- you have your landlords permission to keep a pet. More information on what to do is available at https://www.consumer.vic.gov.au/housing/renting/applying-for-a-rental-property-or-room/pets-and-renting
- you have all the necessary bits and pieces to welcome your new family member, starting with a cat carrier to bring them home, a litter tray, litter, food and bowls as well as a bed, toys and scratchers
- you are ready to welcome them home NOW.
We are unable to hold a cat for you if you are not ready to adopt.
IMPORTANT NOTE - COVID19 PRACTICES
For adoptions, we are following COVID safe practices to ensure your health and that of our volunteers as well as the general community.
We thank you for your patience throughout this process.
All funds raised at Neko HQ are to benefit Maneki Neko Cat Rescue.
Find out more about Maneki Neko Cat Rescue at www.neko.org.au
To keep up to date with all our activities 'like' us at www.facebook.com/nekorescue
Check out our other listings at http://www.petrescue.com.au/groups/10587?listings=active",Male,Domestic Medium Hair Cat,Maneki Neko Cat Rescue,"Preston, VIC",Short,"13 Jan, 2022",199.00,12.0,
183,183,Bowie - Located in Preston,Playful and fun,"Bowie is a sweet boy who loves to play.  He is sweet and curious and loves to play with every toy he can find then snuggle up with you afterward.
APPLY ONLINE at http://www.neko.org.au/adoption-application/
Before applying to meet one of our cats, please ensure that
- you have the agreement of all members of the household to adopt a Cat
- you have your landlords permission to keep a pet. More information on what to do is available at https://www.consumer.vic.gov.au/housing/renting/applying-for-a-rental-property-or-room/pets-and-renting
- you have all the necessary bits and pieces to welcome your new family member, starting with a cat carrier to bring them home, a litter tray, litter, food and bowls as well as a bed, toys and scratchers
- you are ready to welcome them home NOW.
We are unable to hold a cat for you if you are not ready to adopt.
IMPORTANT NOTE - COVID19 PRACTICES
For adoptions, we are following COVID safe practices to ensure your health and that of our volunteers as well as the general community.
We thank you for your patience throughout this process.
All funds raised at Neko HQ are to benefit Maneki Neko Cat Rescue.
Find out more about Maneki Neko Cat Rescue at www.neko.org.au
To keep up to date with all our activities 'like' us at www.facebook.com/nekorescue
Check out our other listings at http://www.petrescue.com.au/groups/10587?listings=active",Male,Domestic Short Hair Cat,Maneki Neko Cat Rescue,"Preston, VIC",Short,"14 Jan, 2022",199.00,6.0,Doesn't have cats| Doesn't have dogs
184,184,Colby,sweet little boy,"Colby is an affectionate little boy who craves company and loves to be smooched. Colby loves to be near people and will curl in a ball and cuddle with you every chance he gets. Colby has a quiet meow which he uses to communicate with his family, asking for food, cuddles, or just reminding you that he is there. Colby is a gorgeous boy with lots of love to give.
Colby must be an indoor cat only.
Colby's siblings are also looking for their forever families:
https://www.petrescue.com.au/listings/887405
https://www.petrescue.com.au/listings/887402
https://www.petrescue.com.au/listings/887398
Colby is currently with his foster family in Moonee Ponds and is hoping to meet his forever family very soon!
Colby will be ready to leave his foster family at the end of January.",Male,Domestic Short Hair Cat,Forever Friends Animal Rescue,"Moonee Ponds, VIC",Short,"12 Jan, 2022",250.00,2.7600000000000002,
185,185,Cynthia,Looking for love,"Cynthia is a sweet smoochy girl looking for a quiet, cat-savvy home. She is a curious and friendly girl. She likes when you come down on the ground with her and stroke her gently. Shell most likely roll around on her back, stretching out her long kegs and showing off her belly. Cynthia may take some time to settle into a new home, so taking it nice and easy with her while she settles is important. Cynthia is absolutely stunning and has beautiful piercing eyes that make it easy to fall deeply in love with her. She is looking for a life full of enrichment and attention from her new family, in an indoor-only home. She doesnt seem to mind the company of other friendly cats, but also would be fine as the only pet of the house.",Female,Domestic Medium Hair Cat,Australian Animal Protection Society (AAPS),"Keysborough, VIC",Medium,"12 Jan, 2022",110.00,13.0,
186,186,Lumos (Located in Corio),Handsome & Kind,"Our very special boy Lumos is finally ready to start looking for his forever home. You wouldnt know that this boy had a rough start to life, as he is such a beautifully natured, gentle and sweet cat with nothing but love in his heart 
You may notice that Lumos has one smaller ear, and we think it makes him look EXTRA cute! Dont you? He was born this way, and it has never bothered him. It simply makes him extra special! 
Lumos just wants to be somebodys sidekick. He wants a best friend to share his life with. He will make an EXCELLENT cuddle buddy, a wonderful companion to share your life with. Hes one of those cats that loves to be close to his person, but he is also more than happy to have some alone time while you are busy. 
Lumos is great with othe cats so he may love living with another friendly cat, he could even happily co-exist with a respectful and gentle dog. Hes not a big fan of dogs that get in his face though, so his potential doggy friend would have to respect his personal space. 
He would love a new family that helps encourage his playful side and gives him plenty of comfy cosy places to nap the day away. He is happiest when he is relaxing next to you on the couch getting scritches under his chin and pats on his big beautiful boof head! Lumos is such an awesome cat, and we know that he will make his future forever family so happy 
Check out our other furry felines available for adoption at:https://www.petrescue.com.au/groups/11890",Male,Domestic Short Hair Cat,Beary Fuzzy Forever Rescue,"Corio, VIC",Short,"12 Jan, 2022",220.00,16.0,
187,187,Mugins,little miss independent,"Muggins: appears shy at first but really isnt - the sassitude is there! 
Loves exploring and being independent but also enjoys cuddles at the end of a busy day exploring and playing.
Muggins enjoys the company of other cats and dogs but does like her space, ok with dogs.
She would love a home with no small children.
Litter trained due to being an indoor cat.",Female,Domestic Short Hair Cat,Chally Animal Rescue,"Bendigo, VIC",Short,"12 Jan, 2022",220.00,3.45,Doesn't have kids under 5| Doesn't have kids from 6 to 12
188,188,Patrick rsua001421,Looking for love,"Patrick is a stunning senior who adores his people. Patrick is affectionate and playful but also can be a bit temperamental.   He has zero tolerance for fellow felines and canines and would be best in an indoor only home where he cannot terrorise the neighbourhood.  He would be best in a home with adults only as he also has no time nor tolerance with children.   He will need a regular brushing to ensure his coat remain matt free.
ADOPTION BY APPOINTMENT ONLY
To make an appointment please complete an online application via the attached link https://www.catprotection.com.au/adoption-online-application-2/",Male,Domestic Medium Hair Cat,The Cat Protection Society of Victoria,"Greensborough, VIC",Medium,"12 Jan, 2022",60.00,109.0,Doesn't have cats| Doesn't have dogs| Doesn't have kids from 6 to 12
189,189,Lexie rsua001231,Looking for love,"Lexie is a beautiful lady who is affectionate, loves a lap and adores being the centre of attention.  She does have a bit of the Torti attitude and if things are not going her way she may share her displeasure in being a bit destructive.  Her new human will need to understand her rules and that she is the queen of the castle.
Lexie does not like her tail or lower back being touched so would be best in a home without children.
ADOPTION BY APPOINTMENT ONLY
To make an appointment please complete an online application via the attached link https://www.catprotection.com.au/adoption-online-application-2/",Female,Domestic Short Hair Cat,The Cat Protection Society of Victoria,"Greensborough, VIC",Short,"12 Jan, 2022",115.00,61.0,Doesn't have cats| Doesn't have dogs| Doesn't have kids from 6 to 12
190,190,Tremlett & Ban-Ki,Looking for love,"Tremlett (11yo) and Ban-Ki (8yo) are a bonded pair who must be adopted together. Ban-Ki  is the shy and timid one of the pair and has never known life without Tremlett by his side, he relies on him and stresses without him. Tremlett is is mentor and best friend. Ban-Ki will take a bit of time and patience to settle into his new home but once comfortable you will find he is relaxed and affectionate.
Tremlett is the outgoing one who is very affectionate and loves lots of cuddles, attention and a lap to curl up on. He is quite confident with new people and loves being with Ban Ki.
They have never been free roaming and would love an indoor only home or one with a safe enclosure to enjoy the outdoors in. A quiet and calm home without children or other pets but with plenty of love and patience.
MC Nos:956000003428587 & 956000002000511
ADOPTION BY APPOINTMENT ONLY
To make an appointment please complete an online application via the attached link https://www.catprotection.com.au/adoption-online-application-2/",Male,Domestic Medium Hair Cat,The Cat Protection Society of Victoria,"Greensborough, VIC",Medium,"12 Jan, 2022",120.00,133.0,Doesn't have cats| Doesn't have dogs| Doesn't have kids under 5| Doesn't have kids from 6 to 12
191,191,Freya STA009168,Looking for love,"Freya is a stunning Torti who is full of Tortitude!  Freya knows her mind and has no hesitance in letting you know if she is displeased. This gorgeous girl needs a Torti experienced human that adores them and understands their personality and traits.   She is not suitable in a home with children or other pets.
ADOPTION BY APPOINTMENT ONLY
To make an appointment please complete an online application via the attached link https://www.catprotection.com.au/adoption-online-application-2/",Female,Domestic Short Hair Cat,The Cat Protection Society of Victoria,"Greensborough, VIC",Short,"12 Jan, 2022",115.00,13.0,Doesn't have cats| Doesn't have dogs| Doesn't have kids under 5| Doesn't have kids from 6 to 12
192,192,Charlie,sweet and playful !,"Hello everyone, my name is Charlie! 
I had a rough start to life, living on the streets and came into care heavily pregnant. Now my babies have found their forever home, it's time for me to find a place to call home. Since learning to become an indoor cat, I can say I much prefer this lifestyle! 
I can still be a little shy, especially around visitors, given time I am becoming more and more confident. My foster mum says I'm very sweet in nature, playful and inquisitive. I often follow my foster mum around the house, rolling on the floor asking to be scratched. 
Without trying to boast, my favourite features about myself are my bright green eyes and the two beauty spots on my nostrils. I am very well behaved.
My foster mum has let me play with many different toys, but my all time favourite is a little piece of Velcro. You can see how much I love this in the video of me.

I am looking for a forever home, preferably in a calm and quiet environment with no other dogs or cats.
Please let my foster mum know if you have the Purrrrrfect forever home for me by clicking the expression of interest button!",Female,Domestic Medium Hair Cat,Forever Friends Animal Rescue,"Thornbury, VIC",Medium,"12 Jan, 2022",175.00,23.0,Doesn't have cats| Doesn't have dogs| Doesn't have kids under 5
