,Unnamed: 0,names,tag_lines,personality,sex,breed,rescue_grp,location,coat,date,fee,age_in_months,preference
0,0,Stone,Affectionate and Playful,"*Please note Stone has time remaining in foster care, this is a pre-adoption*
Meet Stone,
Stone is a handsome boy with the sweetest personality you could want!
Stone is a gentle natured boy who adores human attention. He is a quiet sensitive soul so he does take a little time to warm up but once he is settled, he will be your shadow and best friend. His favourite activities are wrestling his brothers and climbing up and down the cat tower on repeat. This sweet boy has such a loving soul despite his initial shyness when first meeting new people. Little Stone just wants to be your best friend and shadow, and will be the most loyal lifelong companion who will cuddle up in bed with you any chance he can; you'll never have an empty lap with Stone around. 
Stone is a sweet, affectionate and joyful little man who craves company, and it is due to this he will need to be adopted with one of his brothers as he heavily dislikes other cats. He would be alright with a household with older children and no dogs. 
If you would like to submit an adoption application for Stone please follow the link below to our website:
http://www.fosterkittensofmelbourne.org/adopt",Male,Domestic Short Hair Cat,Foster Kittens Of Melbourne,"Wantirna South, VIC",Short,"14 Jan, 2022",400.00,4.0,
1,1,Bart & Lisa,Affectionate and Playful,"*This is a pre-adoption, Bart and Lisa have time remaining in foster care*
Meet Bart and Lisa,
Bart is a brown and white tabby king and Lisa is a tabby queen!
Bartholemew, known as Bart, El Barto, Barty Boxtrot or The Bartarino to his friends, is a delicate little picture of perfect manners to cats and humans alike. Barts a tiny nobleman. He likes to be chauffeured from place to place in your arms, constant cuddles, and has the softest fur known to humankind. Dont let his gentlemanly countenance fool you - he still gets bouts of playful zooms, and is perhaps one of the clumsiest cats ever seen.
Then theres Lisa. While Barts the face of the operation, Lisas the brains. Shes a small burst of energy contained in kitten form. Lisa is a pouncer, a little busy body and just loves to play! If theres something to investigate, Lisa will be there. If theres a fly in the house, Lisa will chase it. If there is anything new whatsoever, she will sniff it, then sniff it again to be sure. Her loves include her brother Bart, any adult cat, having her little belly rubbed, and snuggles.
Together, this dynamic duo with matching stamps of a swirl on their fur and complementary personalities bring life and constant entertainment into any home theyre in.
If you'd like to submit an adoption application for Bart and Lisa, please follow the link below:
www.fosterkittensofmelbourne.org/adopt",Male,Domestic Short Hair Cat,Foster Kittens Of Melbourne,"Docklands, VIC",Short,"14 Jan, 2022",700.00,3.22,
2,2,Slate,Handsome & Cheeky,"*Please note Slate has time remaining in foster care, this is a pre-adoption*
Meet Slate,
This handsome man will sure weasel his way into your heart!
Slate is such a loving, yet cheeky little rascal. He has so much attitude and spunk to him but he craves human attention and affection. Slate spends his days wrestling with his brothers as he has an abundance of energy and is full of beans most of the time. He is a very inquisitive, mischievous and curious little man who needs to be all up in your business all the time. Once hes finished his playing he loves to just take up a spot on his foster mums lap and fall asleep with his engine roaring. He just wants to be your best friend and shadow. At first, meeting new people can be a bit scary to him but he warms up quickly given time and patience. 
Slate is a bubbly, laid back and adoring soul who just simply loves life and wants to get the most out of every second. He will be hot on your heels wanting to be involved in everything his family is. Slate heavily dislikes other cats so will need to be adopted with one of his siblings as he constantly needs to be either cuddling with them or wrestling. A household with gentle older children would be suitable for him. 
If you would like to submit an adoption application for Slate, please follow the link below to our website:
www.fosterkittensofmelbourne.org/adopt",Male,Domestic Medium Hair Cat,Foster Kittens Of Melbourne,"Wantirna South, VIC",Medium,"14 Jan, 2022",400.00,4.0,
3,3,Onyx,Beautiful Soul,"*Please note Onyx has time remaining in foster care, this is a pre-adoption*
Meet Onyx,
He is a handsome loving little man, with a whole lot of attitude to go with the looks.
Onyx is a smoochy affectionate boy, who just loves to be loved. Other than wrestling his siblings, his favourite activity is to snuggle up with his foster parents in bed. He's very cheeky and strong willed, and has a voice on him to tell you off, or demand attention. Onyx absolutely can't resist snuggling into a lap, or smothering a chest with his engine running wild while baking biscuits. He will often wake up through his naps to just make sure we are still there and chirp to us about his dreams. Onyx can be quite shy and skittish when meeting new people, but when settled he is a complete shadow and will be hot on your heels always.
Onyx is a cheeky, loving and independent boy who does things on his own terms. He wants to be all up in your business and be apart of everything you do. Onyx is very social, however he heavily dislikes other cats so will need to be adopted with one his brothers. He would be best suited to a quiet home with older children and no dogs. 
If you would like to submit an adoption application for Onyx please follow the link below to our website:
http://www.fosterkittensofmelbourne.org/adopt",Male,Domestic Short Hair Cat,Foster Kittens Of Melbourne,"Wantirna South, VIC",Short,"14 Jan, 2022",400.00,4.0,
4,4,Pebble,Super Snuggly,"*Please note Pebble has time remaining in foster care, this is a pre-adoption*
Meet Pebble,
He is a total heartbreaker and a massive ray of sunshine!
Pebble is a mischievous little boy, who just craves human attention and love. Once he's finished wrestling and playing with his siblings, he loves snuggling up into a ball in his foster mums' lap with his engine roaring! He is a very curious and inquisitive boy who loves getting into anything he can, especially food. Be warned, he's nailed the signature puppy eyes! Little Pebble  just wants to be your best friend and shadow, and will be the most loyal lifelong companion who will cuddle up in bed with you any chance he can; you'll never have an empty lap with him around! Pebble takes a little time to warm up to new people and surroundings, but in no time and with some patience he'll be bouncing around. 
Pebble is a cheeky, loving and sweet boy who lives life to the fullest each day. He wants to be all up in your business and be apart of everything you do while having fun. He will need to be adopted with one his brothers as he heavily dislikes other cats, yet needs a feline companion. He would be suited to a home with gentle children who understand boundaries.
If you would like to submit an adoption application for Pebble please follow the link below to our website:
www.fosterkittensofmelbourne.org/adopt",Male,Domestic Medium Hair Cat,Foster Kittens Of Melbourne,"Wantirna South, VIC",Medium,"14 Jan, 2022",400.00,4.0,
5,5,Wyatt,Gentle & Loving,"*Please note Wyatt has time remaining in foster care, this is a pre-adoption*
Meet Wyatt,
He is a lovingly gentle giant!
Wyatt is such a calm, affectionate and tender soul who just wants to be as close to people as possible. He is the quiet achiever of his litter of 4, being the only boy. He loves nothing more than to snuggle up with his foster mum and be cradled like a baby in her arms, and to be hot on her heels always like a shadow. Wyatt loves to run wild with his siblings, playing tag, wrestling or even just chewing their tail as all siblings do. Kisses are an essential part of his daily routine whenever you are free, and even when your busy he makes sure to shower you with kisses and nuzzles to remind you he's there. Heartbreaker, total sweetheart and a ladies man are a few ways to describe this incredible boy. He will make the most amazing lifelong companion. When first meeting new people he can be quite reserved and shy, but given time he does get comfortable.
Wyatt has a laid back, loving and joyous temperament which shines bright in his foster home. He will need a family that is willing to help his confidence grow and that has patience. Given his social nature with his foster siblings he would ideally go to a household with his sister Piper. Wyatt has been exposed to children and would be suited to a home preferably teenagers. 
If you'd like to submit an adoption application for Wyatt, follow the link below to our website:
www.fosterkittensofmelbourne.org/adopt",Male,Domestic Short Hair Cat,Foster Kittens Of Melbourne,"Wantirna South, VIC",Short,"14 Jan, 2022",400.00,3.45,
6,6,Piper,Loving Little Miss,"*Please note Piper has time remaining in foster care, this is a pre-adoption*
Meet Piper,
She is a sweet, stunning little pocket rocket! 
Piper is a beautiful little girl, who just craves affection and love. Her favourite things to do are to snuggle up with her foster parents in bed and give them endless kisses, and to be with her foster siblings whom she adores. This little lady truly has the most loving, gentle and sweetest nature; she is nothing but a ray of sunshine in her foster home. Piper is very curious and inquisitive therefore she loves to climb and explore everything she can. Upon meeting new people she can be quite shy, but once she is comfortable, she'll be all over you showering you with her love and kisses. The amount of love in this little girl is astounding, don't be fooled she also has an incredible amount of attitude which just adds to her charm. She is hot on her foster parents heels always, craving human company and love. 
Piper is a cheeky, loving and sassy girl who does things on her own terms but is always near you or mostly on you.  She wants to be all up in your business and be apart of everything you do. Piper would be best suited to a home where she will have her brother Wyatt to keep her company. She would be suited to a home with teenagers, no young children under 13. 
If you'd like to submit an adoption application for Piper, follow the link below to our website:
www.fosterkittensofmelbourne.org/adopt",Female,Domestic Short Hair Cat,Foster Kittens Of Melbourne,"Wantirna South, VIC",Short,"14 Jan, 2022",400.00,3.45,
7,7,Frankie,Lots of Love to Give,"Frankie is a stunning young boy with lots of love to give to his new hooman/s.  He's had a rough start to life being born on the streets until he came into our care earlier this year and fostered.  Within a short time, he has gone from being unable to be touched to loving his back and neck scratches.   He'll reach out with his paw when his foster mum stops the pats, asking for more.  When being patted, he purrs loudly showing his appreciation.
Frankie's new home will need to have a hooman experienced with shy cats and patient as he continues his development.  
He would be best suited to a home without young children as he does get easily frightened.
From his days on the streets, Frankie is FIV+ meaning he needs to be kept contained indoors and even better, if he has an outdoor cat run as well as he does enjoy spending time outside.
Whoever adopts Frankie will have a loyal friend for life.",Male,Domestic Short Hair Cat,Bast Cat Club,"Kangaroo Ground, VIC",Short,"14 Jan, 2022",200,17.0,Doesn't have kids under 5| Doesn't have kids from 6 to 12
8,8,Melody,Looking for love,"Melody has come a long way since first arriving in our care several months ago. She had a litter of tiny kittens with her, all of whom have now been adopted. It is now our beautiful girls time to find her forever home. Melody is timid in new surroundings but with love, patience, and time she has blossomed into a sweet and loving girl. She is very gentle and has a low maintenance nature. Melody is quite happy to spend time alone but she enjoys company. She loves pats and chin scratches and purrs away to voice her contentment. When Melody is completely at ease, she lays on her back for tummy rubs and makes the sweetest little trilling noise. She absolutely loves toys and can often be heard playing away with them and especially loves her cat tunnel.  We must also mention how gorgeous Melody is. With her big bushy tail and soulful green eyes she is absolutely stunning. She has a very distinctive coloured medium length coat which she maintains very well. 
Melody is seeking an understanding forever person, preferably with experience with timid cats. She is sure to continue to flourish and will make a loving companion. Once she settles in we can see her following her person around the house and sticking close to them.  
Melody has been vet checked, vaccinated, microchipped 900141000070759 and is current with flea and worm treatment. Source Number: RE161465. 
**ADOPTION SURVEY**
Please provide as much detail as possible as this allows us to match the cats individual needs and personality to their potential families. Only those that are completed in full will be considered.
 List the ages of your household members (include those who stay regularly)
 List any pets in your home and provide details of their breed, age and if they are desexed
 If applicable how do your pets get along with other animals?
 Please describe any experience you have had with owning cats (specifically timid cats if applicable)
 What is your main reason for wanting to adopt this cat?
 Have you ever given away or surrendered a pet? If so, please describe the situation.
 Provide a brief description of your property e.g.: unit, suburban house, acreage etc 
 Will your cat be kept inside only, inside/outside, outside only?
 Where will your cat sleep?
 What would happen to the cat if you moved?
 Do you consent to a house check to determine its suitability for the cat? If no, please explain your reasoning.
 If your application is shortlisted, when are you available to attend a meet and greet?
 If the meet and greet is successful, when are you available to adopt the cat?",Female,Domestic Medium Hair Cat,Ollie's Legacy Incorporated,"Bendigo, VIC",Medium,"14 Jan, 2022",100.00,17.0,Doesn't have kids under 5| Doesn't have kids from 6 to 12
9,9,Perseus,Loves Zora,"Perseus needs the most special family who will expect nothing from her.
She loves Zora - a cat she has bonded with.
She would do best in a quite house, starting off in a smaller space.
She can be pat and can be picked up. - though she prefers not to - we really dont know her whole story.
Do you have space in your heart and home for these girls?
They love the study and are great work from home companions.",Female,Domestic Medium Hair Cat,MEOW Rescue,"Langwarrin, VIC",Medium,"14 Jan, 2022",100.00,48.0,
10,10,Bobby and Shelly,Double the Love,"** Please ensure you read this profile in full before enquiring. **
Bobby & Shelly, a double bundle of cuteness and curiosity. 
Bobby is a happy cat that loves a pat, bum scratch and playing with his favourite toys. Hell often make his way onto your bed in the mornings looking for a chin scratch. Bobby is a confident cat but will need some time to adjust to his new surroundings and doesnt like forced interactions. When hes ready for attention hell let you know. 
Shelly is a young cat that is still learning to come out of her shell but loves to play with Bobby and explore her surroundings. She is very energetic and will spend hours chasing her favourite toys (and sometimes Bobby!).  Shelly is still very wary and learning to trust humans. She is very timid and doesnt enjoy pats just yet, but her friend Bobby is showing her the ropes and bringing her slowly out of her shell. Shelly has suspected case of severe asthma and as such can be heard coughing from time to time.  She is currently using a slow feeder so that she doesnt inhale her food or steal Bobbys before hes had a chance to eat!
These cats love their food, and youll often hear them chirping to each other and playing after they nap the day away!  They love exploring and finding their hiding spots but will happily come out to play when theyre ready.
Bobby and Shelly will need a lot of patience as they are wary of new surroundings and people at first. Both can play a little rough so would be best suited to a house with no small children, a home that can respect their boundaries, and provide them with an indoor lifestyle. Currently they would prefer to be the only pets in the home.
Bobby and Shelly are located in Bentleigh.
(NOTE: Adoption fee is for both Bobby and Shelly)",Male,Domestic Medium Hair Cat,Forever Friends Animal Rescue,"Bentleigh, VIC",Medium,"14 Jan, 2022",306.00,14.0,Doesn't have cats| Doesn't have dogs| Doesn't have kids under 5| Doesn't have kids from 6 to 12
11,11,Mimi,Curious and friendly,"Hi, I am Mimi! I am a 3y.o. stunner who is looking for her forever home - is it with you?
I am a fluffy gal, quite acrobatic at times (with mixed results) and I LOVE being around my fave people.
Whatever you are up to, I am keen to be involved! I enjoy snuggling up on your lap (or laptop/keyboard), watching tv, and sleeping. When I'm relaxing, I usually like to stay in the same room as my human, just to y'know, keep one eye on you, and keep the other eye staring at the world outside the window.
I enjoy my food and treats...maybe a touch too much. Okay I admit, I could lose a few grams (well that's what the vet said anyway) and I might need your help with this. I am great around new people and visitors but I haven't had much time around kids, although older kids would probably be acceptable (only if they provide lots of gentle pats).
I can be quite playful and love a good piece of string to attack, a box to jump in and balls to chase. After I am worn out, a solid snooze in the sun is ideal.
Ideally I am the only pet in the house because let's face it, I need to be the sole recipient of everyones love and attention. My ideal home would be with someone who is home most of the time (but not essential), given how social I am. I really do love my people! 
Preferably you have a secure outside area, but this is not a requirement. I am very curious about the outdoors but my foster carer has not been successful with getting me into a harness for safe exploring.
I am a healthy and happy girl looking for my FURever home, could this be with you?
Please note: Mimi has recently been desexed and has also had some teeth extracted. She has recovered well!",Female,Domestic Short Hair Cat,Forever Friends Animal Rescue,"Thornbury, VIC",Short,"14 Jan, 2022",175.00,37.0,Doesn't have cats| Doesn't have dogs
12,12,Prem,'Beautiful',"Prem is a beautiful and quiet cat. She loves a good daily brushing on her long coat and will also turn upside down for more!
Prem would be great as a companion cat for a gentle and patient parent.",Female,Domestic Long Hair Cat,Forever Friends Animal Rescue,"Mount Waverley, VIC",Long,"14 Jan, 2022",75.00,135.0,Doesn't have cats| Doesn't have dogs| Doesn't have kids under 5| Doesn't have kids from 6 to 12
13,13,Sandy & Rita  (can be transported to Melb),Sweet girls who need love,"Note: Adoption fee is for the pair 
Sandy & Rita are sweet girls who would love a chance to have a special home of their own. 
They came to us from a property where they were being hand-fed by the workers. 
We believe Rita is Sandy's mama.  
As they had only had minimal human interaction they have adapted really well to positive interaction with humans. 
They are still a bit shy but will accept pats and rub around your legs, are very inquisitive and can be picked up. 
They are very food orientated and will eat anything you put down for them. 
They may hide when they go to a new home but that is normal for any cat that changes to a new environment with new sounds, smells and new people. 
Rita has been the more confident of the two since they have been in care 
They have not been around dogs or children. They have been ok with other cats that were part of their colony but we can't say how they would interact with ones they don't know. 
A quiet, patient household would be the best for these girls so they can settle into their new life at their own pace.  They might never be cats to sit on your lap but that doesn't mean 
that they wont show you love. 
Both these beautiful girls need a patient home who understands where they have come from and how far they have come along. 
They need an owner who will give them all the time they need to properly settle into their new home. 
Rita is the darker grey tabby 
 : Age approx 4
Chip Number: 978101083667303
Sandy - Age : Approx: approx 16 months
Chip number:  978101083681724
Sandy & Rita are strictly indoor only 
Transport to Melbourne is available if needed",Female,Domestic Short Hair Cat,Robyn's Nest Animal Rescue,"Talbot, VIC",Short,"14 Jan, 2022",225.00,16.0,Doesn't have dogs| Doesn't have kids under 5
14,14,Louis,I adore people,"Louis is a handsome fella who has a beautiful personality. 
His favourite thing is to be around people, especially those who spoil him!
He is not fussy with his food, and, even though he is just over 5 years old he still loves to play. 
He has been around a dog that is used to cats and has been around other cats.  
He has briefly been around children who were respectful of his space. 
Louis is a strictly indoor cat only especially due to his light coloured features. 
He is currently looking for his home at our adoption partner store Going Troppo Fish & Pets in Wendouree (Ballarat).  
Note: His full adoption fee comes to us to help more kitties in need like Louis",Male,Domestic Short Hair Cat,Robyn's Nest Animal Rescue,"Wendouree, VIC",Short,"14 Jan, 2022",150.00,61.0,Doesn't have dogs
15,15,Stanley,Looking for love,"Hi there, my name is Stanley and I am looking for a very specific home! I haven't had the easiest time here in the shelter so I need a loving and patient family that will help me adjust back into a home environment. I can be a little conflicted with my interactions sometimes, but I will quickly warm up to you if you give me treats and gentle pats! I would really thrive in the right environment if there is plenty of routine and positive reinforcement.
I've got a couple of things in my medical history that my RSPCA friends would be more than happy to discuss.
If you feel there's a spot in your home for me, please submit an application!
Indemnities:
Heart Murmur - Cat (Medical)
Ringworm Contact (Medical)",Male,Domestic Short Hair Mix Cat,RSPCA Burwood East Victoria,"Burwood East, VIC",Short,"14 Jan, 2022",22.00,14.0,
16,16,Friday rsua009461,Looking for love,"Friday is a delightful girl who is easy going and affectionate and loves cuddles and of course playtime. She would be fine with respectful older children as she does startle easily.
She has no tolerance with other felines so must be your one and only.
ADOPTION BY APPOINTMENT ONLY
To make an appointment please complete an online application via the attached link https://www.catprotection.com.au/adoption-online-application-2/",Female,Domestic Short Hair Cat,The Cat Protection Society of Victoria,"Greensborough, VIC",Short,"14 Jan, 2022",115.00,11.0,Doesn't have cats| Doesn't have dogs| Doesn't have kids under 5| Doesn't have kids from 6 to 12
17,17,Texas STA008721,Looking for love,"Texas came to us from a colony of cats. He was not use to humans, and certainly did not trust us. Shelter life was not for him, so we put him in foster. With long term foster he is learning to trust, and Texas is now enjoying playing with his foster mum. Texas is still gaining his trust of humans, but we feel its his time to go that final step with his forever home.
He is quite playful, and catch and stealing the toys is definitely high on his agenda. Food is a big winner, and will sit for treats from your hand, but sometimes your fingers might get in the road.
He is not an aggressive cat, but learning to play with a human rather than a cat, is something he is still learning. He is still not overly fond of being picked up, but if he does want a cuddle, he will smooch your legs, and a quick big purring cuddle is what you will get.
Texas will do well in a quite home, with a confident feline friend, and has lived comfortably with a dog. If you are happy to have a companion, who will keep you entertained, but will take time to adjust, Texas is a beautiful boy. He is definitely worth the time and effort.
ADOPTION BY APPOINTMENT ONLY
To make an appointment please complete an online application via the attached link https://www.catprotection.com.au/adoption-online-application-2/",Male,Domestic Short Hair Cat,The Cat Protection Society of Victoria,"Greensborough, VIC",Short,"14 Jan, 2022",115.00,13.0,Doesn't have cats| Doesn't have dogs| Doesn't have kids from 6 to 12
18,18,Miffy,Enjoys a Chat!,"Miffy is a very sweet older lady who is looking for a companion to spend the rest of her days with.
She likes to have a little chat with her (very cute) squeaky meow and would love someone to spend some quality time with, getting lots of pats.
Miffy has a heart murmur that may be due to some shelter stress or a heart condition, that will have to be monitored once she is in a home.
If you would like to meet the very sweet Miffy, please give us a call on 9722 1265",Female,Domestic Short Hair Cat,Blue Cross Animals Society,"Wonga Park, VIC",Short,"14 Jan, 2022",50.00,180.0,Doesn't have cats| Doesn't have dogs| Doesn't have kids under 5| Doesn't have kids from 6 to 12
